<testSuite xmlns="http://www.w3c.org/MarkUp/Forms/XForms/Test/11" xsi:schemaLocation="http://www.w3c.org/MarkUp/Forms/XForms/Test/11 XF11TestSuite.xsd" xmlns:xsi="http://www.w3.org/2001/XMLSchema-instance" specVersion="1.1">
    <specChapter chapterName="G. " productId="XSLTForms 1.0" chapterTitle="XForms and Styling">
        <statusSummary>
            <numNormTotal>0</numNormTotal>
            <numNormPass>0</numNormPass>
            <numNormFail>0</numNormFail>
            <numNormUnknown>0</numNormUnknown>
            <numBasicTotal>0</numBasicTotal>
            <numBasicPass>0</numBasicPass>
            <numBasicFail>0</numBasicFail>
            <numBasicUnknown>0</numBasicUnknown>
        </statusSummary>
        <profile>
            <specification>XForms 1.1</specification>
            <normativeOnly>false</normativeOnly>
            <basicOnly>false</basicOnly>
        </profile>
        <testCase>
            <testCaseSection>G.1</testCaseSection>
            <testCaseName>G.1.a</testCaseName>
            <testCaseLink>../../Appendix/G/G.1/g.1.a.xhtml</testCaseLink>
            <testCaseDescription>enabled and disabled pseudo-classes</testCaseDescription>
            <testCaseSpecLinkName>G.1</testCaseSpecLinkName>
            <testCaseSpecLink>http://www.w3.org/TR/xforms11/#N93414</testCaseSpecLink>
            <testCaseBasic>false</testCaseBasic>
            <testCaseNormative>false</testCaseNormative>
            <testCaseStatus>Passed</testCaseStatus>
            <testCaseDate>2014-02-08</testCaseDate>
            <testCaseRequired>false</testCaseRequired>
            <testCaseNote/>
        </testCase>
        <testCase>
            <testCaseSection>G.1</testCaseSection>
            <testCaseName>G.1.b</testCaseName>
            <testCaseLink>../../Appendix/G/G.1/g.1.b.xhtml</testCaseLink>
            <testCaseDescription>required and optional pseudo-classes</testCaseDescription>
            <testCaseSpecLinkName>G.1</testCaseSpecLinkName>
            <testCaseSpecLink>http://www.w3.org/TR/xforms11/#N93414</testCaseSpecLink>
            <testCaseBasic>false</testCaseBasic>
            <testCaseNormative>false</testCaseNormative>
            <testCaseStatus>Failed</testCaseStatus>
            <testCaseDate>2014-02-08</testCaseDate>
            <testCaseRequired>false</testCaseRequired>
            <testCaseNote/>
        </testCase>
        <testCase>
            <testCaseSection>G.1</testCaseSection>
            <testCaseName>G.1.c</testCaseName>
            <testCaseLink>../../Appendix/G/G.1/g.1.c.xhtml</testCaseLink>
            <testCaseDescription>valid and invalid pseudo-classes</testCaseDescription>
            <testCaseSpecLinkName>G.1</testCaseSpecLinkName>
            <testCaseSpecLink>http://www.w3.org/TR/xforms11/#N93414</testCaseSpecLink>
            <testCaseBasic>false</testCaseBasic>
            <testCaseNormative>false</testCaseNormative>
            <testCaseStatus>Failed</testCaseStatus>
            <testCaseDate>2014-02-08</testCaseDate>
            <testCaseRequired>false</testCaseRequired>
            <testCaseNote/>
        </testCase>
        <testCase>
            <testCaseSection>G.1</testCaseSection>
            <testCaseName>G.1.d</testCaseName>
            <testCaseLink>../../Appendix/G/G.1/g.1.d.xhtml</testCaseLink>
            <testCaseDescription>read-only and read-write pseudo-classes</testCaseDescription>
            <testCaseSpecLinkName>G.1</testCaseSpecLinkName>
            <testCaseSpecLink>http://www.w3.org/TR/xforms11/#N93414</testCaseSpecLink>
            <testCaseBasic>false</testCaseBasic>
            <testCaseNormative>false</testCaseNormative>
            <testCaseStatus>Failed</testCaseStatus>
            <testCaseDate>2014-02-08</testCaseDate>
            <testCaseRequired>false</testCaseRequired>
            <testCaseNote/>
        </testCase>
        <testCase>
            <testCaseSection>G.1</testCaseSection>
            <testCaseName>G.1.e</testCaseName>
            <testCaseLink>../../Appendix/G/G.1/g.1.e.xhtml</testCaseLink>
            <testCaseDescription>out-of-range and in-range pseudo-classes</testCaseDescription>
            <testCaseSpecLinkName>G.1</testCaseSpecLinkName>
            <testCaseSpecLink>http://www.w3.org/TR/xforms11/#N93414</testCaseSpecLink>
            <testCaseBasic>false</testCaseBasic>
            <testCaseNormative>false</testCaseNormative>
            <testCaseStatus>Failed</testCaseStatus>
            <testCaseDate>2014-02-08</testCaseDate>
            <testCaseRequired>false</testCaseRequired>
            <testCaseNote/>
        </testCase>
        <testCase>
            <testCaseSection>G.2</testCaseSection>
            <testCaseName>G.2.a</testCaseName>
            <testCaseLink>../../Appendix/G/G.2/g.2.a.xhtml</testCaseLink>
            <testCaseDescription>value pseudo-element</testCaseDescription>
            <testCaseSpecLinkName>G.2</testCaseSpecLinkName>
            <testCaseSpecLink>http://www.w3.org/TR/xforms11/#N93548</testCaseSpecLink>
            <testCaseBasic>false</testCaseBasic>
            <testCaseNormative>false</testCaseNormative>
            <testCaseStatus>Failed</testCaseStatus>
            <testCaseDate>2014-02-08</testCaseDate>
            <testCaseRequired>false</testCaseRequired>
            <testCaseNote/>
        </testCase>
        <testCase>
            <testCaseSection>G.2</testCaseSection>
            <testCaseName>G.2.b</testCaseName>
            <testCaseLink>../../Appendix/G/G.2/g.2.b.xhtml</testCaseLink>
            <testCaseDescription>repeat-item pseudo-element</testCaseDescription>
            <testCaseSpecLinkName>G.2</testCaseSpecLinkName>
            <testCaseSpecLink>http://www.w3.org/TR/xforms11/#N93548</testCaseSpecLink>
            <testCaseBasic>false</testCaseBasic>
            <testCaseNormative>false</testCaseNormative>
            <testCaseStatus>Failed</testCaseStatus>
            <testCaseDate>2014-02-08</testCaseDate>
            <testCaseRequired>false</testCaseRequired>
            <testCaseNote/>
        </testCase>
        <testCase>
            <testCaseSection>G.2</testCaseSection>
            <testCaseName>G.2.c</testCaseName>
            <testCaseLink>../../Appendix/G/G.2/g.2.c.xhtml</testCaseLink>
            <testCaseDescription>repeat-index pseudo-element</testCaseDescription>
            <testCaseSpecLinkName>G.2</testCaseSpecLinkName>
            <testCaseSpecLink>http://www.w3.org/TR/xforms11/#N93548</testCaseSpecLink>
            <testCaseBasic>false</testCaseBasic>
            <testCaseNormative>false</testCaseNormative>
            <testCaseStatus>Failed</testCaseStatus>
            <testCaseDate>2014-02-08</testCaseDate>
            <testCaseRequired>false</testCaseRequired>
            <testCaseNote/>
        </testCase>
        <testCase>
            <testCaseSection>G.2</testCaseSection>
            <testCaseName>G.2.d</testCaseName>
            <testCaseLink>../../Appendix/G/G.2/g.2.d.xhtml</testCaseLink>
            <testCaseDescription>repeat-index precedence over repeat-item</testCaseDescription>
            <testCaseSpecLinkName>G.2</testCaseSpecLinkName>
            <testCaseSpecLink>http://www.w3.org/TR/xforms11/#N93548</testCaseSpecLink>
            <testCaseBasic>false</testCaseBasic>
            <testCaseNormative>false</testCaseNormative>
            <testCaseStatus>Failed</testCaseStatus>
            <testCaseDate>2014-02-08</testCaseDate>
            <testCaseRequired>false</testCaseRequired>
            <testCaseNote/>
        </testCase>
    </specChapter>
</testSuite>