<?xml version="1.0" encoding="UTF-8"?>
<testSuite xmlns:xsi="http://www.w3.org/2001/XMLSchema-instance" xsi:schemaLocation="http://www.w3c.org/MarkUp/Forms/XForms/Test/11 XF11TestSuite.xsd" specVersion="1.1"
    xmlns="http://www.w3c.org/MarkUp/Forms/XForms/Test/11">
    <specChapter chapterName="2. " productId="" chapterTitle="Introduction to XForms">
        <statusSummary>
            <numNormTotal>0</numNormTotal>
            <numNormPass>0</numNormPass>
            <numNormFail>0</numNormFail>
            <numNormUnknown>0</numNormUnknown>
            <numBasicTotal>0</numBasicTotal>
            <numBasicPass>0</numBasicPass>
            <numBasicFail>0</numBasicFail>
            <numBasicUnknown>0</numBasicUnknown>
        </statusSummary>
        <profile>
            <specification>XForms 1.1</specification>
            <normativeOnly>false</normativeOnly>
            <basicOnly>false</basicOnly>
        </profile>
        <testCase>
            <testCaseSection>2.1</testCaseSection>
            <testCaseName>2.1.a</testCaseName>
            <testCaseLink>../../Chapt02/2.1.a.xhtml</testCaseLink>
            <testCaseDescription>Introductory Example No. 1</testCaseDescription>
            <testCaseSpecLinkName>2.1</testCaseSpecLinkName>
            <testCaseSpecLink>http://www.w3.org/TR/xforms11/#concepts-xhtml</testCaseSpecLink>
            <testCaseBasic>true</testCaseBasic>
            <testCaseNormative>true</testCaseNormative>
            <testCaseStatus>Unknown</testCaseStatus>
            <testCaseDate>2005-09-10</testCaseDate>
            <testCaseRequired>true</testCaseRequired>
            <testCaseNote />
        </testCase>
        <testCase>
            <testCaseSection>2.2</testCaseSection>
            <testCaseName>2.2.a</testCaseName>
            <testCaseLink>../../Chapt02/2.2.a.xhtml</testCaseLink>
            <testCaseDescription>Example: Encapsulation of Instance Data</testCaseDescription>
            <testCaseSpecLinkName>2.2</testCaseSpecLinkName>
            <testCaseSpecLink>http://www.w3.org/TR/xforms11/#concepts-xml-instance-data</testCaseSpecLink>
            <testCaseBasic>true</testCaseBasic>
            <testCaseNormative>true</testCaseNormative>
            <testCaseStatus>Unknown</testCaseStatus>
            <testCaseDate>2005-09-10</testCaseDate>
            <testCaseRequired>true</testCaseRequired>
            <testCaseNote />
        </testCase>
        <testCase>
            <testCaseSection>2.3</testCaseSection>
            <testCaseName>2.3.a</testCaseName>
            <testCaseLink>../../Chapt02/2.3.a.xhtml</testCaseLink>
            <testCaseDescription>Example: Value Constraints</testCaseDescription>
            <testCaseSpecLinkName>2.3</testCaseSpecLinkName>
            <testCaseSpecLink>http://www.w3.org/TR/xforms11/#concepts-model</testCaseSpecLink>
            <testCaseBasic>false</testCaseBasic>
            <testCaseNormative>true</testCaseNormative>
            <testCaseStatus>Unknown</testCaseStatus>
            <testCaseDate>2005-09-10</testCaseDate>
            <testCaseRequired>true</testCaseRequired>
            <testCaseNote />
        </testCase>
        <testCase>
            <testCaseSection>2.4</testCaseSection>
            <testCaseName>2.4.a</testCaseName>
            <testCaseLink>../../Chapt02/2.4.a.xhtml</testCaseLink>
            <testCaseDescription>Example: Multiple Forms</testCaseDescription>
            <testCaseSpecLinkName>2.4</testCaseSpecLinkName>
            <testCaseSpecLink>http://www.w3.org/TR/xforms11/#concepts-multiple</testCaseSpecLink>
            <testCaseBasic>false</testCaseBasic>
            <testCaseNormative>true</testCaseNormative>
            <testCaseStatus>Unknown</testCaseStatus>
            <testCaseDate>2005-09-10</testCaseDate>
            <testCaseRequired>true</testCaseRequired>
            <testCaseNote />
        </testCase>
    </specChapter>
</testSuite>